{"document_type":"rust-mutants/catalog","schema_version":1,"tool_version":"0.1.0","workspace":{"root_name":"fixture-unicode","toolchain":"rustc 1.98.0 (88d9e12ae 2026-08-18)","workspace_digest":"e6aadab10ee1573e81c153848e64852bc0c4d4707f435305c81361ed7eb75751","catalog_digest":"4bbadbfa63b3c621e87dfbbfaac15359c7fff49ba37b67b893a2649f0d078cf0","platform":{"os":"darwin","arch":"aarch64","target":"aarch64-apple-darwin"}},"selection":{"tier":"balanced","operators":[],"include":[],"exclude":[],"packages":[]},"mutants":[{"index":0,"id":"cd0fe30657c3066384f8871f4ab02db4acb687a416a6b9ef58d4421f33055e42","display_id":"cd0fe30657c3066384f8","path":"src/lib.rs","package":"fixture-unicode","family":"return-replacement","rule":"return-default","item":"大きい方","rule_version":1,"line":7,"column":61,"start_byte":408,"end_byte":437,"source_digest":"273de0e5158d38a5d461dee0fe970e7eb64a3067bf09947af01c74362ad3f62a","original":"if γ > β { γ } else { β }","replacement":"Default::default()"},{"index":1,"id":"e3b6704b5ad1a397b70e82a9b1bd7eb2a518ef7c29ade1a20c9b9845e7799ce1","display_id":"e3b6704b5ad1a397b70e","path":"src/lib.rs","package":"fixture-unicode","family":"condition-negation","rule":"negate-condition","item":"大きい方","rule_version":1,"line":7,"column":64,"start_byte":411,"end_byte":418,"source_digest":"273de0e5158d38a5d461dee0fe970e7eb64a3067bf09947af01c74362ad3f62a","original":"γ > β","replacement":"!(γ > β)"},{"index":2,"id":"b9ee60c80aeb0d583a9a7dd7d212d7f0d74301b5106b021bb85e6927cde15aad","display_id":"b9ee60c80aeb0d583a9a","path":"src/lib.rs","package":"fixture-unicode","family":"condition-removal","rule":"condition-to-true","item":"大きい方","rule_version":1,"line":7,"column":64,"start_byte":411,"end_byte":418,"source_digest":"273de0e5158d38a5d461dee0fe970e7eb64a3067bf09947af01c74362ad3f62a","original":"γ > β","replacement":"true"},{"index":3,"id":"8397c7a24300958e56326c38deb7c84de928f936f3f3faa06a9d4fe3f7629a20","display_id":"8397c7a24300958e5632","path":"src/lib.rs","package":"fixture-unicode","family":"condition-removal","rule":"condition-to-false","item":"大きい方","rule_version":1,"line":7,"column":64,"start_byte":411,"end_byte":418,"source_digest":"273de0e5158d38a5d461dee0fe970e7eb64a3067bf09947af01c74362ad3f62a","original":"γ > β","replacement":"false"},{"index":4,"id":"d7e3b82f4dbc216eb916218ca08d9a5457e7b1399b512aeb20ccdbc345f7c072","display_id":"d7e3b82f4dbc216eb916","path":"src/lib.rs","package":"fixture-unicode","family":"comparison","rule":"gt-to-ge","item":"大きい方","rule_version":1,"line":7,"column":67,"start_byte":414,"end_byte":415,"source_digest":"273de0e5158d38a5d461dee0fe970e7eb64a3067bf09947af01c74362ad3f62a","original":">","replacement":">="},{"index":5,"id":"072bf7bcf30d93f1125093b20717de8d50733f010cabe850a174b8130f6ddc41","display_id":"072bf7bcf30d93f11250","path":"src/lib.rs","package":"fixture-unicode","family":"return-replacement","rule":"return-default","item":"大きい方","rule_version":1,"line":7,"column":74,"start_byte":421,"end_byte":423,"source_digest":"273de0e5158d38a5d461dee0fe970e7eb64a3067bf09947af01c74362ad3f62a","original":"γ","replacement":"Default::default()"},{"index":6,"id":"b8365b4dc7ef3c68c890a3635e0196692d7801bb7ae95e6d6f4a00b1bfa02e4d","display_id":"b8365b4dc7ef3c68c890","path":"src/lib.rs","package":"fixture-unicode","family":"return-replacement","rule":"return-default","item":"大きい方","rule_version":1,"line":7,"column":86,"start_byte":433,"end_byte":435,"source_digest":"273de0e5158d38a5d461dee0fe970e7eb64a3067bf09947af01c74362ad3f62a","original":"β","replacement":"Default::default()"},{"index":7,"id":"a1e14ecf9c4786a86b9a9c12d2f7a1d3b76db303a1b41e56d3d312559d96e119","display_id":"a1e14ecf9c4786a86b9a","path":"src/lib.rs","package":"fixture-unicode","family":"return-replacement","rule":"return-default","item":"使われない","rule_version":1,"line":11,"column":5,"start_byte":555,"end_byte":561,"source_digest":"273de0e5158d38a5d461dee0fe970e7eb64a3067bf09947af01c74362ad3f62a","original":"δ * 2","replacement":"Default::default()"},{"index":8,"id":"e3376fd69875370e7c064d342816bbe84153a94f9f5c5fa5eaffb399ed0d3b96","display_id":"e3376fd69875370e7c06","path":"src/lib.rs","package":"fixture-unicode","family":"arithmetic","rule":"mul-to-div","item":"使われない","rule_version":1,"line":11,"column":8,"start_byte":558,"end_byte":559,"source_digest":"273de0e5158d38a5d461dee0fe970e7eb64a3067bf09947af01c74362ad3f62a","original":"*","replacement":"/"}],"rejections":[],"skips":[]}