{"document_type":"rust-mutants/catalog","schema_version":1,"tool_version":"0.1.0","workspace":{"root_name":"fixture-faulted","toolchain":"rustc 1.98.0 (88d9e12ae 2026-08-18)","workspace_digest":"8782e308c92ceb47be7a365391d887ad4ea2138aa27be41ae08ef1ae2950f3e5","catalog_digest":"b9eb2637fbb668ab1274db73374a862f1ebd5a7e91fa3b967dafeb1f714d43d3","platform":{"os":"darwin","arch":"aarch64","target":"aarch64-apple-darwin"}},"selection":{"tier":"all","operators":["inject-error"],"include":[],"exclude":[],"packages":[]},"mutants":[{"index":0,"id":"509495a290b98b4059ddd6e3355766b93182ee947672e4eb060a74aa3f2b47fb","display_id":"509495a290b98b4059dd","path":"src/lib.rs","package":"fixture-faulted","family":"fault","rule":"inject-error","item":"load","rule_version":1,"line":13,"column":16,"start_byte":368,"end_byte":397,"source_digest":"eb9cc3c324d54ed28c44babfddacaedbcd2d53be282a0a3b4e6272b1c5091d1e","original":"std::fs::read_to_string(path)","replacement":"::core::result::Result::Err(rust_mutants::injected())"},{"index":1,"id":"50063b7172f5aa389494af4c9c645eb69092ea59ce88339856d24d627701e4f4","display_id":"50063b7172f5aa389494","path":"src/lib.rs","package":"fixture-faulted","family":"fault","rule":"inject-error","item":"number","rule_version":1,"line":22,"column":18,"start_byte":577,"end_byte":602,"source_digest":"eb9cc3c324d54ed28c44babfddacaedbcd2d53be282a0a3b4e6272b1c5091d1e","original":"text.trim().parse::<u8>()","replacement":"::core::result::Result::Err(rust_mutants::injected())"},{"index":2,"id":"2a0878a9c9fafede852bca837eb017a7bfd2d8314e072db28d1fbc475b94327a","display_id":"2a0878a9c9fafede852b","path":"src/lib.rs","package":"fixture-faulted","family":"fault","rule":"inject-error","item":"measured","rule_version":1,"line":33,"column":16,"start_byte":866,"end_byte":895,"source_digest":"eb9cc3c324d54ed28c44babfddacaedbcd2d53be282a0a3b4e6272b1c5091d1e","original":"std::fs::read_to_string(path)","replacement":"::core::result::Result::Err(rust_mutants::injected())"},{"index":5,"id":"46faf01aa6fd0ab957111b9398e0d49424ca9d1445bb432673eb3280fbab71e0","display_id":"46faf01aa6fd0ab95711","path":"src/lib.rs","package":"fixture-faulted","family":"fault","rule":"inject-error","item":"spare","rule_version":1,"line":66,"column":16,"start_byte":1562,"end_byte":1591,"source_digest":"eb9cc3c324d54ed28c44babfddacaedbcd2d53be282a0a3b4e6272b1c5091d1e","original":"std::fs::read_to_string(path)","replacement":"::core::result::Result::Err(rust_mutants::injected())"},{"index":6,"id":"0c45bebe8e3816e2bec2018e9d1b9946a764858f206c17cab027b1cb25c23849","display_id":"0c45bebe8e3816e2bec2","path":"src/lib.rs","package":"fixture-faulted","family":"fault","rule":"inject-error","item":"linger","rule_version":1,"line":75,"column":16,"start_byte":1817,"end_byte":1846,"source_digest":"eb9cc3c324d54ed28c44babfddacaedbcd2d53be282a0a3b4e6272b1c5091d1e","original":"std::fs::read_to_string(path)","replacement":"::core::result::Result::Err(rust_mutants::injected())"},{"index":7,"id":"151ed0632c142c1f2c162165c30d7d0e80a54addf66639ef88aacff4405898e8","display_id":"151ed0632c142c1f2c16","path":"src/lib.rs","package":"fixture-faulted","family":"fault","rule":"inject-error","item":"refused","rule_version":1,"line":84,"column":16,"start_byte":2056,"end_byte":2085,"source_digest":"eb9cc3c324d54ed28c44babfddacaedbcd2d53be282a0a3b4e6272b1c5091d1e","original":"std::fs::read_to_string(path)","replacement":"::core::result::Result::Err(rust_mutants::injected())"}],"rejections":[{"index":3,"id":"0f98bccdf068ab298f41ede4485641e2126465ef3e4820da9c0a7a1d27cbf9a1","display_id":"0f98bccdf068ab298f41","path":"src/lib.rs","rule":"inject-error","code":"E0277","diagnostic":"error[E0277]: the trait bound `Refused: Injectable` is not satisfied\n   --> src/lib.rs:46:150\n    |\n 46 | ...ctive(3) { ::core::result::Result::Err(__rm_b1a35a68::injected()) } else { inner() })?;\n    |                                           ^^^^^^^^^^^^^^^^^^^^^^^^^ unsatisfied trait bound\n    |\nhelp: the trait `Injectable` is not implemented for `Refused`\n   --> src/lib.rs:39:1\n    |\n 39 | pub struct Refused;\n    | ^^^^^^^^^^^^^^^^^^\n    = help: the following other types implement trait `Injectable`:\n              FromUtf8Error\n              ParseFloatError\n              ParseIntError\n              TryFromIntError\n              Utf8Error\n              std::io::Error\nnote: required by a bound in `injected`\n   --> src/lib.rs:455:31\n    |\n455 |     pub(crate) fn injected<E: Injectable>() -> E {\n    |                               ^^^^^^^^^^ required by this bound in `injected`\n\n","isolated":true,"reason":"compiler-refused"},{"index":4,"id":"99f09b1f9f215888215f0e33d609c1d4455e81905b272b9efe28ab6e1e01eb1a","display_id":"99f09b1f9f215888215f","path":"src/lib.rs","rule":"inject-error","code":"E0308","diagnostic":"error[E0308]: `if` and `else` have incompatible types\n  --> src/lib.rs:57:187\n   |\n57 | ...ve(4) { ::core::result::Result::Err(__rm_b1a35a68::injected()) } else { value })?;\n   |            ------------------------------------------------------          ^^^^^ expected `Result<_, _>`, found `Option<u8>`\n   |            |\n   |            expected because of this\n   |\n   = note: expected enum `Result<_, _>`\n              found enum `Option<u8>`\nhelp: try wrapping the expression in a variant of `Result`\n   |\n57 |     __rm_b1a35a68::item(6); __rm_b1a35a68::checkpoint(); let inside = __rm_b1a35a68::value!(if __rm_b1a35a68::active(4) { ::core::result::Result::Err(__rm_b1a35a68::injected()) } else { Ok(value) })?;\n   |                                                                                                                                                                                           +++     +\n57 |     __rm_b1a35a68::item(6); __rm_b1a35a68::checkpoint(); let inside = __rm_b1a35a68::value!(if __rm_b1a35a68::active(4) { ::core::result::Result::Err(__rm_b1a35a68::injected()) } else { Err(value) })?;\n   |                                                                                                                                                                                           ++++     +\n\n","isolated":true,"reason":"compiler-refused"}],"skips":[]}