{"document_type":"rust-mutants/catalog","schema_version":1,"tool_version":"0.1.0","workspace":{"root_name":"fixture-simple","toolchain":"rustc 1.98.0 (88d9e12ae 2026-08-18)","workspace_digest":"c98680650112ac9cc825ed3205f354e2410e638ef0e0034be0b8c372893fd2cd","catalog_digest":"9cb332e10b4fe7d47bd0713b1378e5d3050656de6b789ea6bce0abec92aff24c","platform":{"os":"darwin","arch":"aarch64","target":"aarch64-apple-darwin"}},"selection":{"tier":"balanced","operators":[],"include":[],"exclude":[],"packages":[]},"mutants":[{"index":0,"id":"4f09b8f6515d886cf6387723d68261f316aa7dbb2a3666b1c8f7d58790b850d1","display_id":"4f09b8f6515d886cf638","path":"src/lib.rs","package":"fixture-simple","family":"return-replacement","rule":"return-default","item":"max","rule_version":1,"line":11,"column":5,"start_byte":389,"end_byte":414,"source_digest":"e5c82cdb402211599158ceb4098e7411234f0c43a03f8dca8774d753b04880c6","original":"if a > b { a } else { b }","replacement":"Default::default()"},{"index":1,"id":"36f3786c607b2028824691676b177e457e5f5da28d7f6b3df1ed4a189ad386b3","display_id":"36f3786c607b20288246","path":"src/lib.rs","package":"fixture-simple","family":"condition-negation","rule":"negate-condition","item":"max","rule_version":1,"line":11,"column":8,"start_byte":392,"end_byte":397,"source_digest":"e5c82cdb402211599158ceb4098e7411234f0c43a03f8dca8774d753b04880c6","original":"a > b","replacement":"!(a > b)"},{"index":2,"id":"97dcf2a134137b47d1850cdd3b62ae26e3ee9dfe74fc665b9ed0661b64f557cc","display_id":"97dcf2a134137b47d185","path":"src/lib.rs","package":"fixture-simple","family":"condition-removal","rule":"condition-to-true","item":"max","rule_version":1,"line":11,"column":8,"start_byte":392,"end_byte":397,"source_digest":"e5c82cdb402211599158ceb4098e7411234f0c43a03f8dca8774d753b04880c6","original":"a > b","replacement":"true"},{"index":3,"id":"355723c8d204e44dac608654f17bd3645d6e2786078bcc812a024c34187dfc3b","display_id":"355723c8d204e44dac60","path":"src/lib.rs","package":"fixture-simple","family":"condition-removal","rule":"condition-to-false","item":"max","rule_version":1,"line":11,"column":8,"start_byte":392,"end_byte":397,"source_digest":"e5c82cdb402211599158ceb4098e7411234f0c43a03f8dca8774d753b04880c6","original":"a > b","replacement":"false"},{"index":4,"id":"f0d20edfda2959667ff19be48ef229cba965a672c7a6e367624a73bc4fcec22f","display_id":"f0d20edfda2959667ff1","path":"src/lib.rs","package":"fixture-simple","family":"comparison","rule":"gt-to-ge","item":"max","rule_version":1,"line":11,"column":10,"start_byte":394,"end_byte":395,"source_digest":"e5c82cdb402211599158ceb4098e7411234f0c43a03f8dca8774d753b04880c6","original":">","replacement":">="},{"index":5,"id":"29fa56091a8bb5622f20dfafa7b9ab7982535576605e2aab1ad2e6db0b93da22","display_id":"29fa56091a8bb5622f20","path":"src/lib.rs","package":"fixture-simple","family":"return-replacement","rule":"return-default","item":"max","rule_version":1,"line":11,"column":16,"start_byte":400,"end_byte":401,"source_digest":"e5c82cdb402211599158ceb4098e7411234f0c43a03f8dca8774d753b04880c6","original":"a","replacement":"Default::default()"},{"index":6,"id":"7dade0daa6fdfca0540ad3f1b3b648f4445d93709faaa4d801018efe5d161455","display_id":"7dade0daa6fdfca0540a","path":"src/lib.rs","package":"fixture-simple","family":"return-replacement","rule":"return-default","item":"max","rule_version":1,"line":11,"column":27,"start_byte":411,"end_byte":412,"source_digest":"e5c82cdb402211599158ceb4098e7411234f0c43a03f8dca8774d753b04880c6","original":"b","replacement":"Default::default()"},{"index":7,"id":"c7df40a2d69eae0d983d9cfc2836ba948deed4663b0926e6467de4740b38702f","display_id":"c7df40a2d69eae0d983d","path":"src/lib.rs","package":"fixture-simple","family":"return-replacement","rule":"return-true","item":"is_even","rule_version":1,"line":16,"column":5,"start_byte":480,"end_byte":490,"source_digest":"e5c82cdb402211599158ceb4098e7411234f0c43a03f8dca8774d753b04880c6","original":"n % 2 == 0","replacement":"true"},{"index":8,"id":"00e556aa9db45bd9d1d59d166eb532b59a925e71179c2cc34d7b63bce0072e4f","display_id":"00e556aa9db45bd9d1d5","path":"src/lib.rs","package":"fixture-simple","family":"arithmetic","rule":"rem-to-mul","item":"is_even","rule_version":1,"line":16,"column":7,"start_byte":482,"end_byte":483,"source_digest":"e5c82cdb402211599158ceb4098e7411234f0c43a03f8dca8774d753b04880c6","original":"%","replacement":"*"},{"index":9,"id":"4cd205f7d6faa29392aec5d445ffeedf238cddd61887d3e577bd809ee1d1b4d6","display_id":"4cd205f7d6faa29392ae","path":"src/lib.rs","package":"fixture-simple","family":"comparison","rule":"eq-to-neq","item":"is_even","rule_version":1,"line":16,"column":11,"start_byte":486,"end_byte":488,"source_digest":"e5c82cdb402211599158ceb4098e7411234f0c43a03f8dca8774d753b04880c6","original":"==","replacement":"!="}],"rejections":[],"skips":[{"reason":"test-only-file","path":"src/testutil.rs","count":2,"explanation":"only a test unit compiles the file, so no non-test binary could carry the mutant"},{"reason":"let-condition","path":"src/lib.rs","count":1,"explanation":"the condition binds with let, and what a guard would have to rearrange is what the binding is in scope for"}]}