{"document_type":"rust-mutants/catalog","schema_version":1,"tool_version":"0.1.0","workspace":{"root_name":"fixture-baseline","toolchain":"rustc 1.98.0 (88d9e12ae 2026-08-18)","workspace_digest":"5b802384eef9d7c7388d28a83e789574404155b4ffbad7d1f872e9e1d8b17feb","catalog_digest":"c89876104fda2e769ccea7f9038c8f84e1570cb31f093f37bdcb25748cf66c3b","platform":{"os":"darwin","arch":"aarch64","target":"aarch64-apple-darwin"}},"selection":{"tier":"balanced","operators":[],"include":[],"exclude":[],"packages":[]},"mutants":[{"index":0,"id":"00c6fea6140456f15a4f31ce2f86f79482bf9f4766d0b2bf7c13e0e5d9015003","display_id":"00c6fea6140456f15a4f","path":"src/lib.rs","package":"fixture-baseline","family":"return-replacement","rule":"return-default","item":"sign","rule_version":1,"line":8,"column":5,"start_byte":461,"end_byte":565,"source_digest":"400591d2b6d70ca7438752af8cd8d95dacff6daa96a65af1e1b0e80c0f7c275e","original":"if n > 0 {\n        \"positive\"\n    } else if n < 0 {\n        \"negative\"\n    } else {\n        \"zero\"\n    }","replacement":"Default::default()"},{"index":1,"id":"aec569b677a2d793ec6034642dc4be3ef136f69a0adac8fd87d975fb7910f392","display_id":"aec569b677a2d793ec60","path":"src/lib.rs","package":"fixture-baseline","family":"condition-negation","rule":"negate-condition","item":"sign","rule_version":1,"line":8,"column":8,"start_byte":464,"end_byte":469,"source_digest":"400591d2b6d70ca7438752af8cd8d95dacff6daa96a65af1e1b0e80c0f7c275e","original":"n > 0","replacement":"!(n > 0)"},{"index":2,"id":"2f0c4aff9635ecc97852a2b8cfb545e3b8080597920de0906af1c4048a363639","display_id":"2f0c4aff9635ecc97852","path":"src/lib.rs","package":"fixture-baseline","family":"condition-removal","rule":"condition-to-true","item":"sign","rule_version":1,"line":8,"column":8,"start_byte":464,"end_byte":469,"source_digest":"400591d2b6d70ca7438752af8cd8d95dacff6daa96a65af1e1b0e80c0f7c275e","original":"n > 0","replacement":"true"},{"index":3,"id":"2b790ae18077638397123282456b96c9c86738a836da2c56a44dc2c1b36952a4","display_id":"2b790ae1807763839712","path":"src/lib.rs","package":"fixture-baseline","family":"condition-removal","rule":"condition-to-false","item":"sign","rule_version":1,"line":8,"column":8,"start_byte":464,"end_byte":469,"source_digest":"400591d2b6d70ca7438752af8cd8d95dacff6daa96a65af1e1b0e80c0f7c275e","original":"n > 0","replacement":"false"},{"index":4,"id":"7590b327de928142a7d4e8cc4ae668248ee9ee2b4172df2e50f0b0f751fca283","display_id":"7590b327de928142a7d4","path":"src/lib.rs","package":"fixture-baseline","family":"comparison","rule":"gt-to-ge","item":"sign","rule_version":1,"line":8,"column":10,"start_byte":466,"end_byte":467,"source_digest":"400591d2b6d70ca7438752af8cd8d95dacff6daa96a65af1e1b0e80c0f7c275e","original":">","replacement":">="},{"index":5,"id":"916ac16c73c7c959f7e011fee78ff8913b4c111a32eada8a695c46cf8afe8431","display_id":"916ac16c73c7c959f7e0","path":"src/lib.rs","package":"fixture-baseline","family":"return-replacement","rule":"return-default","item":"sign","rule_version":1,"line":9,"column":9,"start_byte":480,"end_byte":490,"source_digest":"400591d2b6d70ca7438752af8cd8d95dacff6daa96a65af1e1b0e80c0f7c275e","original":"\"positive\"","replacement":"Default::default()"},{"index":6,"id":"13d60fff74f48ec22ca0586df4deea6de7232a5c7c97f13a7ae6d3cfc111e26d","display_id":"13d60fff74f48ec22ca0","path":"src/lib.rs","package":"fixture-baseline","family":"condition-negation","rule":"negate-condition","item":"sign","rule_version":1,"line":10,"column":15,"start_byte":505,"end_byte":510,"source_digest":"400591d2b6d70ca7438752af8cd8d95dacff6daa96a65af1e1b0e80c0f7c275e","original":"n < 0","replacement":"!(n < 0)"},{"index":7,"id":"411d46d889aef733e693cf673e90b067bfa5667c3caf264c85ab4e67e2fc4c58","display_id":"411d46d889aef733e693","path":"src/lib.rs","package":"fixture-baseline","family":"condition-removal","rule":"condition-to-true","item":"sign","rule_version":1,"line":10,"column":15,"start_byte":505,"end_byte":510,"source_digest":"400591d2b6d70ca7438752af8cd8d95dacff6daa96a65af1e1b0e80c0f7c275e","original":"n < 0","replacement":"true"},{"index":8,"id":"9f9db85e50c14a6e3fcc17e6af4f6f090b119e886870d248fa3002f4ff568167","display_id":"9f9db85e50c14a6e3fcc","path":"src/lib.rs","package":"fixture-baseline","family":"condition-removal","rule":"condition-to-false","item":"sign","rule_version":1,"line":10,"column":15,"start_byte":505,"end_byte":510,"source_digest":"400591d2b6d70ca7438752af8cd8d95dacff6daa96a65af1e1b0e80c0f7c275e","original":"n < 0","replacement":"false"},{"index":9,"id":"57a197f6d1d0e560e888f4ccfabf8bf5afdc5104803c10ad734dc1e82f724c30","display_id":"57a197f6d1d0e560e888","path":"src/lib.rs","package":"fixture-baseline","family":"comparison","rule":"lt-to-le","item":"sign","rule_version":1,"line":10,"column":17,"start_byte":507,"end_byte":508,"source_digest":"400591d2b6d70ca7438752af8cd8d95dacff6daa96a65af1e1b0e80c0f7c275e","original":"<","replacement":"<="},{"index":10,"id":"0e40ade9c35f305329070539a0fe711e321debd055c7cc986616594877bdeec9","display_id":"0e40ade9c35f30532907","path":"src/lib.rs","package":"fixture-baseline","family":"return-replacement","rule":"return-default","item":"sign","rule_version":1,"line":11,"column":9,"start_byte":521,"end_byte":531,"source_digest":"400591d2b6d70ca7438752af8cd8d95dacff6daa96a65af1e1b0e80c0f7c275e","original":"\"negative\"","replacement":"Default::default()"},{"index":11,"id":"b6d893a120ece7625630185b13789a952ae273852a039ef38db32a18b382a50e","display_id":"b6d893a120ece7625630","path":"src/lib.rs","package":"fixture-baseline","family":"return-replacement","rule":"return-default","item":"sign","rule_version":1,"line":13,"column":9,"start_byte":553,"end_byte":559,"source_digest":"400591d2b6d70ca7438752af8cd8d95dacff6daa96a65af1e1b0e80c0f7c275e","original":"\"zero\"","replacement":"Default::default()"},{"index":12,"id":"7c995250658c8c7eed50b6bf7f149ca970a29efb30fd21f0ab0018549ee2621c","display_id":"7c995250658c8c7eed50","path":"src/lib.rs","package":"fixture-baseline","family":"return-replacement","rule":"return-default","item":"double","rule_version":1,"line":19,"column":5,"start_byte":690,"end_byte":695,"source_digest":"400591d2b6d70ca7438752af8cd8d95dacff6daa96a65af1e1b0e80c0f7c275e","original":"n * 2","replacement":"Default::default()"},{"index":13,"id":"43043104a9c81f823b187962a0f7a09211269f74aaad22161f24e8ee9a8c2959","display_id":"43043104a9c81f823b18","path":"src/lib.rs","package":"fixture-baseline","family":"arithmetic","rule":"mul-to-div","item":"double","rule_version":1,"line":19,"column":7,"start_byte":692,"end_byte":693,"source_digest":"400591d2b6d70ca7438752af8cd8d95dacff6daa96a65af1e1b0e80c0f7c275e","original":"*","replacement":"/"}],"rejections":[],"skips":[{"reason":"test-code","path":"src/lib.rs","count":1,"explanation":"the code is a test: a #[test] function or anything behind #[cfg(test)], which measures itself"}]}