{"document_type":"rust-mutants/catalog","schema_version":1,"tool_version":"0.1.0","workspace":{"root_name":"fixture-unreached","toolchain":"rustc 1.98.0 (88d9e12ae 2026-08-18)","workspace_digest":"913adead0d8f08549baec71f56d97dc96246f7e0be16db77e913335929f5352a","catalog_digest":"03c20af27c9024062341116ff85836fcf3a0955215778abecd0001f5c374dd22","platform":{"os":"darwin","arch":"aarch64","target":"aarch64-apple-darwin"}},"selection":{"tier":"all","operators":[],"include":[],"exclude":[],"packages":[]},"mutants":[{"index":0,"id":"e010e0c5502360e32ec0a43081dfa0679905fd0651208f5bfdcb515adf4c2755","display_id":"e010e0c5502360e32ec0","path":"src/lib.rs","package":"fixture-unreached","family":"return-replacement","rule":"return-default","item":"double","rule_version":1,"line":8,"column":5,"start_byte":327,"end_byte":332,"source_digest":"2103d6659121d9d0149a4d776f3cb3fc149931bc893fbb9126c09015a46b9730","original":"n * 2","replacement":"Default::default()"},{"index":1,"id":"f58e61c9fe509c7dcec1d613fb897987c75a830e41d466b5bb7fac88a5dead38","display_id":"f58e61c9fe509c7dcec1","path":"src/lib.rs","package":"fixture-unreached","family":"arithmetic","rule":"mul-to-div","item":"double","rule_version":1,"line":8,"column":7,"start_byte":329,"end_byte":330,"source_digest":"2103d6659121d9d0149a4d776f3cb3fc149931bc893fbb9126c09015a46b9730","original":"*","replacement":"/"},{"index":2,"id":"1a363ec2bd14692d52c92ad20424fee6c6c6f2713e0c67e5bd1c0752d7fcac6b","display_id":"1a363ec2bd14692d52c9","path":"src/lib.rs","package":"fixture-unreached","family":"literal","rule":"int-increment","item":"double","rule_version":1,"line":8,"column":9,"start_byte":331,"end_byte":332,"source_digest":"2103d6659121d9d0149a4d776f3cb3fc149931bc893fbb9126c09015a46b9730","original":"2","replacement":"3"},{"index":3,"id":"7a749d05de3d25726a913c91fecca050d9a79ed292c4dbd62445983b5fad3214","display_id":"7a749d05de3d25726a91","path":"src/lib.rs","package":"fixture-unreached","family":"literal","rule":"int-decrement","item":"double","rule_version":1,"line":8,"column":9,"start_byte":331,"end_byte":332,"source_digest":"2103d6659121d9d0149a4d776f3cb3fc149931bc893fbb9126c09015a46b9730","original":"2","replacement":"1"},{"index":4,"id":"7bc1a89b2f20e4b99d3971a14415f14ef10c825157cf0c337b168559b3705b0e","display_id":"7bc1a89b2f20e4b99d39","path":"src/lib.rs","package":"fixture-unreached","family":"return-replacement","rule":"return-default","item":"half","rule_version":1,"line":13,"column":5,"start_byte":450,"end_byte":455,"source_digest":"2103d6659121d9d0149a4d776f3cb3fc149931bc893fbb9126c09015a46b9730","original":"n / 2","replacement":"Default::default()"},{"index":5,"id":"ed276f8cacfdd04c9d9914dcb517955bbb30e9a85bfd420120aa5f3df3aba01e","display_id":"ed276f8cacfdd04c9d99","path":"src/lib.rs","package":"fixture-unreached","family":"arithmetic","rule":"div-to-mul","item":"half","rule_version":1,"line":13,"column":7,"start_byte":452,"end_byte":453,"source_digest":"2103d6659121d9d0149a4d776f3cb3fc149931bc893fbb9126c09015a46b9730","original":"/","replacement":"*"},{"index":6,"id":"8de1ee99dfb47cc2b8ac63451f53fce4ba7a4d4a1dd31b77c5d26b3c720a2846","display_id":"8de1ee99dfb47cc2b8ac","path":"src/lib.rs","package":"fixture-unreached","family":"literal","rule":"int-increment","item":"half","rule_version":1,"line":13,"column":9,"start_byte":454,"end_byte":455,"source_digest":"2103d6659121d9d0149a4d776f3cb3fc149931bc893fbb9126c09015a46b9730","original":"2","replacement":"3"},{"index":7,"id":"be2e35f687f8d3ec20385c73f5297133b006b4d4729e93dc5f6dd35f15463c98","display_id":"be2e35f687f8d3ec2038","path":"src/lib.rs","package":"fixture-unreached","family":"literal","rule":"int-decrement","item":"half","rule_version":1,"line":13,"column":9,"start_byte":454,"end_byte":455,"source_digest":"2103d6659121d9d0149a4d776f3cb3fc149931bc893fbb9126c09015a46b9730","original":"2","replacement":"1"}],"rejections":[],"skips":[{"reason":"test-code","path":"src/lib.rs","count":4,"explanation":"the code is a test: a #[test] function or anything behind #[cfg(test)], which measures itself"}]}