{"document_type":"rust-mutants/catalog","schema_version":1,"tool_version":"0.1.0","workspace":{"root_name":"fixture-doctest","toolchain":"rustc 1.98.0 (88d9e12ae 2026-08-18)","workspace_digest":"d21228442b1be0e78bd4fb07cf1d4d7080d6d9bbf6d9c7e700f319506d751a60","catalog_digest":"8bd86d6c7fe175c2b89cf9c48aa92c9f06e5527f4b1641e1338118f1eb3fc2e0","platform":{"os":"darwin","arch":"aarch64","target":"aarch64-apple-darwin"}},"selection":{"tier":"all","operators":[],"include":[],"exclude":[],"packages":[]},"mutants":[{"index":0,"id":"2c1f4cddc02920c0e918dd5000a2fd0d8b0a90ee1f16d75f7fb4962ec4c82dd3","display_id":"2c1f4cddc02920c0e918","path":"src/lib.rs","package":"fixture-doctest","family":"return-replacement","rule":"return-default","item":"double","rule_version":1,"line":12,"column":5,"start_byte":388,"end_byte":393,"source_digest":"c7b7c94bfbb34471d9d9515b4378d7d791aad88704d7478e95fae5e752cd61c7","original":"n * 2","replacement":"Default::default()"},{"index":1,"id":"6b2f2e02ac65e5adbe88530a617eb45dc3403641f05dc6bc5b6354d39d1731bf","display_id":"6b2f2e02ac65e5adbe88","path":"src/lib.rs","package":"fixture-doctest","family":"arithmetic","rule":"mul-to-div","item":"double","rule_version":1,"line":12,"column":7,"start_byte":390,"end_byte":391,"source_digest":"c7b7c94bfbb34471d9d9515b4378d7d791aad88704d7478e95fae5e752cd61c7","original":"*","replacement":"/"},{"index":2,"id":"39198b227a3142abbc342fe0142913a61bf58c0b3c5fe5c8ea70c0504fa90c5b","display_id":"39198b227a3142abbc34","path":"src/lib.rs","package":"fixture-doctest","family":"literal","rule":"int-increment","item":"double","rule_version":1,"line":12,"column":9,"start_byte":392,"end_byte":393,"source_digest":"c7b7c94bfbb34471d9d9515b4378d7d791aad88704d7478e95fae5e752cd61c7","original":"2","replacement":"3"},{"index":3,"id":"a36364fb78b6f958b916205e899d6ee97d22f8d8d2a14898b58bf6d63f368a1a","display_id":"a36364fb78b6f958b916","path":"src/lib.rs","package":"fixture-doctest","family":"literal","rule":"int-decrement","item":"double","rule_version":1,"line":12,"column":9,"start_byte":392,"end_byte":393,"source_digest":"c7b7c94bfbb34471d9d9515b4378d7d791aad88704d7478e95fae5e752cd61c7","original":"2","replacement":"1"},{"index":4,"id":"d377c9234c7a5299c309d28f1694ef3bb03ec8e17ca8c3b6783bdd55afa7a33d","display_id":"d377c9234c7a5299c309","path":"src/lib.rs","package":"fixture-doctest","family":"return-replacement","rule":"return-default","item":"half","rule_version":1,"line":21,"column":5,"start_byte":594,"end_byte":599,"source_digest":"c7b7c94bfbb34471d9d9515b4378d7d791aad88704d7478e95fae5e752cd61c7","original":"n / 2","replacement":"Default::default()"},{"index":5,"id":"6c81a8d651f4206c8c5ca6c48eee81526b7cd5938d399c37f383987571f46801","display_id":"6c81a8d651f4206c8c5c","path":"src/lib.rs","package":"fixture-doctest","family":"arithmetic","rule":"div-to-mul","item":"half","rule_version":1,"line":21,"column":7,"start_byte":596,"end_byte":597,"source_digest":"c7b7c94bfbb34471d9d9515b4378d7d791aad88704d7478e95fae5e752cd61c7","original":"/","replacement":"*"},{"index":6,"id":"ce040631144c3edad48fa887636bcea048dcdcfbb3e43b99ff168f032e5f402a","display_id":"ce040631144c3edad48f","path":"src/lib.rs","package":"fixture-doctest","family":"literal","rule":"int-increment","item":"half","rule_version":1,"line":21,"column":9,"start_byte":598,"end_byte":599,"source_digest":"c7b7c94bfbb34471d9d9515b4378d7d791aad88704d7478e95fae5e752cd61c7","original":"2","replacement":"3"},{"index":7,"id":"0230ec49bdcc6720ddab5ba903acb5a4afa4fd2cf6988fb9aef36accf726a7b3","display_id":"0230ec49bdcc6720ddab","path":"src/lib.rs","package":"fixture-doctest","family":"literal","rule":"int-decrement","item":"half","rule_version":1,"line":21,"column":9,"start_byte":598,"end_byte":599,"source_digest":"c7b7c94bfbb34471d9d9515b4378d7d791aad88704d7478e95fae5e752cd61c7","original":"2","replacement":"1"},{"index":8,"id":"f3ad4c17a5ed248f50402df3cea5f739c560d85c0e4921015be8032d7239a490","display_id":"f3ad4c17a5ed248f5040","path":"src/lib.rs","package":"fixture-doctest","family":"return-replacement","rule":"return-default","item":"third","rule_version":1,"line":30,"column":5,"start_byte":885,"end_byte":890,"source_digest":"c7b7c94bfbb34471d9d9515b4378d7d791aad88704d7478e95fae5e752cd61c7","original":"n / 3","replacement":"Default::default()"},{"index":9,"id":"d225e77ab9e2e80d4ce7cb366b2c2b0745a0b2be959dbf6db250bf048cca7273","display_id":"d225e77ab9e2e80d4ce7","path":"src/lib.rs","package":"fixture-doctest","family":"arithmetic","rule":"div-to-mul","item":"third","rule_version":1,"line":30,"column":7,"start_byte":887,"end_byte":888,"source_digest":"c7b7c94bfbb34471d9d9515b4378d7d791aad88704d7478e95fae5e752cd61c7","original":"/","replacement":"*"},{"index":10,"id":"15fcfb536f056888a1bb43634785714aa6d5cce0bc5fb68ec8b02fb38d3e9b78","display_id":"15fcfb536f056888a1bb","path":"src/lib.rs","package":"fixture-doctest","family":"literal","rule":"int-increment","item":"third","rule_version":1,"line":30,"column":9,"start_byte":889,"end_byte":890,"source_digest":"c7b7c94bfbb34471d9d9515b4378d7d791aad88704d7478e95fae5e752cd61c7","original":"3","replacement":"4"},{"index":11,"id":"061421ea0003708c1c0a65fa34849ffe36f67886fea85295a27fa9dc5b1f6335","display_id":"061421ea0003708c1c0a","path":"src/lib.rs","package":"fixture-doctest","family":"literal","rule":"int-decrement","item":"third","rule_version":1,"line":30,"column":9,"start_byte":889,"end_byte":890,"source_digest":"c7b7c94bfbb34471d9d9515b4378d7d791aad88704d7478e95fae5e752cd61c7","original":"3","replacement":"2"}],"rejections":[],"skips":[{"reason":"test-code","path":"src/lib.rs","count":4,"explanation":"the code is a test: a #[test] function or anything behind #[cfg(test)], which measures itself"}]}